{
  "schemaVersion": "1.0",
  "image": { "ref": "question-media/heart/diagram/heart-diagram.png", "alt": "Diagram of the human heart", "role": "diagram", "width": 800, "height": 600 },
  "imageWidth": 800,
  "imageHeight": 600,
  "mode": "tap",
  "hotspots": [
    { "id": "h1", "x": 50, "y": 30, "shape": "circle", "radius": 10 },
    { "id": "h2", "x": 50, "y": 70, "shape": "circle", "radius": 10 }
  ]
}